{
  "contract_identity": {
    "contract_id": "stage4-example-builder-001",
    "version": "0.1",
    "contract_hash": "2a12469766b09ba4b4593b90c77990b83f251ad9044488312103d15607276267"
  },
  "assignment": {
    "task_id": "stage4-example-task-001",
    "role_id": "BUILDER",
    "grant_type": "EXPLICIT_ROLE_GRANT",
    "assignment_authority": "Shin",
    "shin_gate_reference": "GO — STAGE 4 v0.1 EXAMPLE BUILDER",
    "assignee_identity": "example-builder",
    "execution_context_identity": "context-example-builder-001",
    "role_acceptance": "ACCEPTED"
  },
  "owned_responsibility": {
    "responsibility": "Implement only the fixed example target.",
    "exact_target": [
      "README.md"
    ],
    "next_owner": "Shin"
  },
  "operations": {
    "allowed_operations": [
      "IMPLEMENT_DESIGN",
      "READ_TARGET",
      "RUN_TESTS",
      "PRODUCE_EXIT_RECEIPT",
      "GENERATE_COVERAGE_GAP_RECOMMENDATION"
    ],
    "forbidden_operations": [
      "AUDIT_TARGET",
      "SELF_AUDIT",
      "MODIFY_ROLE_GRANT",
      "MODIFY_SPECIALIST_LENS",
      "MODIFY_OUTSIDE_TARGET",
      "MERGE",
      "POST",
      "INVOKE_SPECIALIST",
      "START_STAGE_5"
    ]
  },
  "task_artifact_packet": {
    "repo": "shin4141/decision-os-v13-loopkit",
    "head": "3a14dc65ea15f2d81cf3b3cd33362b3c001c0a41",
    "paths": [
      "README.md"
    ],
    "artifact_hashes": {
      "README.md": "decc254e317b693604084ecdc1e9bfe034b8d6b69b32a70404fc63d64055ad39"
    },
    "as_of": "2026-07-29T00:00:00Z"
  },
  "specialist_lens": {
    "lens_id": "v13-stage4-specialist-lens",
    "lens_version": "0.1",
    "lens_hash": "5e1636a7c576112450d36c4b5fa935d24cb44af741576a111421f0bfba12aa8d"
  },
  "independence_profile": {
    "role_context_independence": "SAME_CONTEXT_ALLOWED",
    "source_review_independence": "FULL_PRIOR_CONTEXT_ALLOWED",
    "runtime_execution_independence": "NOT_REQUIRED",
    "model_diversity": "SAME_MODEL_ALLOWED"
  },
  "completion": {
    "completion_line": "The fixed example target is implemented and its Role Exit Receipt is complete.",
    "required_exit_receipt": true,
    "coverage_gap_required": true
  },
  "lifecycle": {
    "issued_at": "2026-07-29T00:00:00Z",
    "expires_at": "2026-07-30T00:00:00Z",
    "revocation_reference": null,
    "status": "ACTIVE"
  },
  "coverage_gap_recommendation": {
    "coverage_completed": true,
    "coverage_gap": "NONE DETECTED",
    "recommended_specialist": "NONE",
    "reason": "The fixed Builder responsibility is fully covered.",
    "exact_target": [
      "README.md"
    ],
    "required_evidence": [
      "Role Exit Receipt"
    ],
    "urgency": "NONE",
    "assignment_authority_required": true,
    "automatic_invocation": false
  }
}
